Text,Score
"Habiendo probado un par de otras marcas de galletas sándwich sin gluten, estas son las mejores del grupo.Son crujientes y fieles a la textura de las otras galletas 'reales' que no son sin gluten.Algunos podrían pensar que el relleno las hace un poco demasiado dulces,\ 
pero para mí eso solo significa que he satisfecho mi gusto por lo dulce más rápido.La versión de chocolate de Glutino es igual de buena y tiene un verdadero sabor a 'chocolate',\ 
algo que no está presente en las otras marcas sin gluten disponibles.
",5
"Meine Katze liebt diese Leckerlis. Wenn ich sie im Haus nicht finden kann,öffne ich einfach den Deckel und sie schießt aus ihrem Versteck, um ein Leckerli zu holen.Sie mag keine knusprigen Leckerlis, daher sind diese perfekt für sie.Ich habe ihr alle drei Geschmacksrichtungen gegeben, und sie scheint sie alle gleichermaßen zu mögen.Allerdings neigen sie dazu, auszutrocknen, wenn ich mich dem Ende der Flasche nähere.Der Klappdeckel ist sehr praktisch. Sehr schöne, preiswerte Leckerlis für Katzen.Ich habe noch keine Katze getroffen, die diese nicht liebt!
",5
"Un po' meno di quanto mi aspettassi. Tende ad avere un sapore fangoso,non quello che mi aspettavo dato che hanno detto che era il preferito dell'azienda.
",3
"First there was Frosted Mini-Wheats, in original size, then there was Frosted Mini-Wheats Bite Size. Well, if for some reason those were too much of a mouthful, we now have Frosted Mini-Wheats Little Bits. Yes, these are about half the size of the Bite Size versions. This particular one is ""Cinnamon Roll"".<br /><br />There is nothing new to the table here with the exception of size, which I is unnecessary. Personally, I like original flavor and size the best. But the Bite Size edition were accommodating. These come off as a desperate attempt to give attention to a brand that needs some sort of life put back into it and all they came up with was making them smaller and having a new flavor, which is actually too sweet for me.<br /><br />A serving size is approximately 47 biscuits. Thats 1 gram of polyunsaturated fat, 46 grams of carbohydrates, 6g fiber, 12g of sugar, 5g of protein and 200mg of potassium. Generally they look good but I guess those that are watching their carb intake might want to be careful.<br /><br />These probably fit on a spoon better than its predecessors in a bowl of milk, but I like the other kinds cause they snack better without the milk. But here, these small ones are easily to snack more than you should.<br /><br />I am grading this product 2 stars for 3 reasons 1) I dont think making them smaller has any reason for existing outside of Kellogs filling the shelves with more versions of something that was fine to begin with. 2) This flavor, Cinnamon Roll, is sweet and has a synthetic taste to it. 3) On the plus side, I like Mini-Wheats in general, so it saved it from being one star.",2
"En ik wil de grafisch ontwerper feliciteren voor het plaatsen van de volledige productnaam op zo'n kleine doos.De reclamemakers moeten er echt lang en diep over hebben nagedacht.<br /><br />Maar serieus, ik hou van het product. De smaak was verfrissend en ik vond dat de smaak aangenaam was zonder nasmaak.Niet te zoet, en Goudlokje zou daar gestopt zijn als er een keuze uit 3 was geweest.Makkelijk in gebruik, je giet de inhoud gewoon in een fles van 16 oz water en schudt.Goed gemengd, geen korrels, je kunt echt niets meer vragen en Lipton, zoals een goede drugsdealer,weet wat ze doen: geef me een gratis smaak en ik ben voor het leven verkocht. 5 sterren.
",5
